<?xml version="1.0" encoding="UTF-8"?><cprov:traceabilityDocument xmlns:cprov="http://labs.orange.com/uk/cprov#" xmlns:ex="http://www.example.org/" xmlns:prov="http://www.w3.org/ns/prov#" xmlns:r="http://labs.orange.com/uk/r#" xmlns:opmx="http://openprovenance.org/model/opmx#" xmlns:cu="http://www.w3.org/1999/xhtml/datatypes/" xmlns:cprovd="http://labs.orange.com/uk/cprovd#" xmlns:xsi="http://www.w3.org/2001/XMLSchema-instance" xmlns:confidenshare="http://labs.orange.com/uk/confidenshare#" xsi:schemaLocation="http://labs.orange.com/uk/cprov# file:/Users/mufy/Dropbox/EngD/year3/schema/cProv-inherited/cProv-v1.3.xsd"><prov:agent prov:id="ex:ag003"/><cprov:cResource prov:id="ex:e001"><cprov:resType>cprovd:data</cprov:resType><cprov:userTrustDegree>1</cprov:userTrustDegree><cprov:userCloudRef>http://orangecloud/user@matt/cluster001/image001</cprov:userCloudRef><cprov:vResourceRef>/linux/meetingService/res001</cprov:vResourceRef><cprov:pResourceRef>/Cluster001/126.23.43.45/server001/00-12-00-12-00-1/e001</cprov:pResourceRef><cprov:TTL>2015-10-10T12:00:00-05:00</cprov:TTL></cprov:cResource></cprov:traceabilityDocument>